,RStation,Country,SMS
2176,Gorongosa,Mozambique,nao pode casar so pode continuar a estudar                                                                                                                                                                                                                     
2177,Gorongosa,Mozambique,Ela não deve casa so deve fazer chegar o asunt ao adminístrado  porq deve ir a escola é a solucão de tudo                                                                                                                                                      
2178,Gorongosa,Mozambique,Ela nao pode casar deve estudar                                                                                                                                                                                                                                
2179,Gorongosa,Mozambique,Sou Natalia aki nhmssngora.Nao pd csar.Ela dve xtudar pra amanha ajudar as irmazinhas delas.                                                                                                                                                                   
2180,Gorongosa,Mozambique,Os alunos da 5classe turma A na EPC d Nhambondo(a menina nao pode casar vamos estudar colega o destino ta cm Deus).                                                                                                                                            
2181,Gorongosa,Mozambique,"NAO PODE CASAR.SINAO VAI PIORAR A SITUACAO,AMAE DEVE SER INPREENDEDORA OU CASA.BOLINGO ALUNO DA ESCOLA EDUARDO M.CANDA.                                                                                                                                        "
2182,Gorongosa,Mozambique,gabriel victor so deve continuar a estudar                                                                                                                                                                                                                     
2183,Gorongosa,Mozambique,"SOU EU AMERICO MARICHEIRA APARTR D NHAMSSONGORA,NAO PD CASAR,DVE ESTDAR PARA FUTURO DA MANHA.                                                                                                                                                                  "
2184,Gorongosa,Mozambique,"AGINADA TEM KI ESTUDAR,NAO HA UM MARIDO KI PODE SUSTENTAR A SUA FAMLIA.SOU LUCAS TENESSE DA 1CLASSE NA EPC D NHAMBONDO.                                                                                                                                        "
2185,Gorongosa,Mozambique,"Mestre jeremias apartir do domingos ubaleathu ,Nao deve casar pois no caso sera o casamento prematuro e sera ploblemas sociais no prossimo.                                                                                                                    "
2186,Gorongosa,Mozambique,Nao.porque ela se conseguir terminar xtdr e trabalhar sera melhor futura pra ela juntamente com a mae.boa tard JULIO MUIANGA NA VILA D GORONGOSA.                                                                                                              
2187,Gorongosa,Mozambique,"Ela nào dve casar, quando sao esses tipos casos, aproxima o Administrador d Gorongosa, para velar xta situacao, Bandeìra, forcas xpeciais, comandos.                                                                                                           "
2188,Gorongosa,Mozambique,Nao pode casa .pur k nao sera a solucao para combater a pobresa k a a familha enflenta. Luis  Tandike estudante da 11 classe A02 Eduardo Mondlane.                                                                                                             
2189,Gorongosa,Mozambique,"Lucas Manuel Tenesse em nhambondo=a agina tem ki continuar a estudar pork apesar da vida n se improvisar mas sim investe si, mas tem k estdar menma pra seu bem.                                                                                               "
2190,Gorongosa,Mozambique,A MENINA NÃO DEVE CASAR MAS A MÃE SIM DEVE CASAR PARA SUSTENTAR AS MENINAS POR K O HOMEM K IRÁ CASAR AMENINA NÃO ACEITARÁ TIRAR O DINHEIRO DE LOBOLO E SUSTENTAR AS CUNHADINHAS E A SOGRA. LEOPOLDINA DA PISTA.                                                
2191,Gorongosa,Mozambique,NAO DEVE CASAR SOU EU GERMIAS.                                                                                                                                                                                                                                 
2192,Gorongosa,Mozambique,nao deve casar e bom estudar sonia                                                                                                                                                                                                                             
2193,Gorongosa,Mozambique,"Ela nao pod.pork a idde e k diz. mais ter na mente k a escola nao e a fonte da riqueza nao e nenhum prblema.[bom progrm]comprment para o locutor,Julio Muinga, ainda mais pra toda a familia da igrja CRISTO VIVE. sou Hino.                                   "
2194,Gorongosa,Mozambique,NAO DEVE CASAR DEVE ESTODAR ESCOLA ET0DO SOU EU ERNESTO NHANCUCO                                                                                                                                                                                               
2195,Gorongosa,Mozambique,Nao Deve Casa Tenqui Continuar Com Os Estudo.Inacio                                                                                                                                                                                                            
2196,Gorongosa,Mozambique,NAO DEVE CAZAR PORQUE AUMENTALA A SUA APOBLEZA.                                                                                                                                                                                                                
2197,Gorongosa,Mozambique,"Boa tard sou Tita, nao dve casar é preciso abraçar a xcola, pork a xcola é a melhor enxada. Marido d hoje nao se confia.                                                                                                                                       "
2198,Gorongosa,Mozambique,SOU BITONE AMIGO DE FREND DOS SANTO.ALUNO DA ESCOLA SECUNDARIA GERAL DE NHAMATANDA.ALUNO DE 11 CLASSE. AO DEVO  CASAR.PORQUEM EU PESO NO FUTURO.                                                                                                               
2199,Gorongosa,Mozambique,Aginada tem ki estudar pork a pobreza nao mata apenas desgrassa.e leite n se pode salgar.lucas manuel tenesse_nhambondo.                                                                                                                                       
2200,Gorongosa,Mozambique,Nao deve cazar sinao ade ver nadica de cobara so mateus                                                                                                                                                                                                        
2201,Gorongosa,Mozambique,A Ginada Nao Deve Casar Hoje Em Dia Nao A Homem Qui Pode Siportar A Famila  De Molher Nome Carlos Jose Canda                                                                                                                                                   
2202,Gorongosa,Mozambique,Nao deve casar. Pork o futuro dela esta nas maos da escola. Nao sera a soluÇao de lhe fazer casar com essa idade. Rosa Belarmino pai d chinha.                                                                                                                 
2203,Gorongosa,Mozambique,Nao pode cazar sinao vai  ver nadica de cobara                                                                                                                                                                                                                 
2204,Gorongosa,Mozambique,Nâo se deve casar o Governo poderia ajudar ela para continuar a estudar.Charles Mucodza                                                                                                                                                                        
2205,Gorongosa,Mozambique,NAO  DEVE  CASAR  AMENINA  SO  A  MAE  DEVE  CASAR  SOU  EU  ZACARIAS                                                                                                                                                                                          
2206,Gorongosa,Mozambique,A MAE É K DEVE SE CASAR. PASTOR SPEED MAPOMBUE                                                                                                                                                                                                                 
2207,Gorongosa,Mozambique,A MENINA NAO PODE CASAR DEVE CONTINUAR A ESTUDAR.TRECELINA ARAUJO.BAIRRO MATUCUDUR                                                                                                                                                                             
2208,Gorongosa,Mozambique,NAO DEVE CASAR.FUTURO DELA E A ESCOLHA DELA.DEUS LHE BENCOA.DONATE MAPOMBUE                                                                                                                                                                                    
2209,Gorongosa,Mozambique,"Samuel domingos chota,nao deve casar so chore em deus favor minha colega aginada.                                                                                                                                                                              "
2210,Gorongosa,Mozambique,"ela nao deve se casar,porque se casar sedo nao é acabar com pobreza..paulinoaraujo.bairro matucudur.                                                                                                                                                           "
2211,Gorongosa,Mozambique,"Casar e ideia d pobreza,e digo ela minha colega que igonore essa ideia d casar.samuel.                                                                                                                                                                         "
2212,Gorongosa,Mozambique,não pode casar deve acontinuar a estudar sou eu camilo estoa aqui na escola                                                                                                                                                                                    
2213,Gorongosa,Mozambique,"Casar e ideia d pobreza,e digo ela minha colega que igonore essa ideia d casar.                                                                                                                                                                                "
2214,Gorongosa,Mozambique,Amenina naô podé sel casada  teng qúi estúdal  meú nome chamo me mo                                                                                                                                                                                            
2215,Gorongosa,Mozambique,NAO PODE CASAR DEVE ESTUDAR PARA VER A VIDA  DE AMANHA.EU SOU DANCA DE TSIQUIR.                                                                                                                                                                                
2216,Gorongosa,Mozambique,Nao deve casa . Ai quem deve casar é a propria mae para sustentar essas crianÇas. Agora vejamos  e se essas crianÇas tivesse 5 anos quem devia casar. MARTA.                                                                                                   
2217,Gorongosa,Mozambique,BOA TARD AKI CANDIDO RAFAEL A MINHA RESPOSTA E  ELA NAO DEVE CASAR PORK CASANDO NAO VAI CONTINUANDO COM SEUS ESTUDOS PORK UM DIA DEUS IRA NHE DAR SORT D                                                                                                       
2218,Gorongosa,Mozambique,"nao deve casar, mas sim dve abracar a escola, pois a xcola lhe dara melhor futuro. paulo judas.                                                                                                                                                                "
2219,Gorongosa,Mozambique,A ASNADA DVE CASAR SALVA S HAVER UM PATROCINADOR PRK A PBREZA DÂ DXTINO INEXPERAVEL.HUMBERTO D CRITO REI                                                                                                                                                       
2220,Gorongosa,Mozambique,NAO DEVE CASAL CONTINUA SEMPLE AESTUDAL DEUS TI LEMCOPECALAM.SOU MATEUS APALTIL EM CUDZO.                                                                                                                                                                      
2221,Gorongosa,Mozambique,Nao deve pense a escola depois podes casar soqui estou a pedir uma musica de liloca ta doce sou eu elias tome matucudur                                                                                                                                        
2222,Gorongosa,Mozambique,NAO  DEVE  CASAR  PURQUE  AVIDA  DELA  TORNA_RA  MAIS  DIFICEL  SOU  EU  ZACARIAS                                                                                                                                                                              
2223,Gorongosa,Mozambique,nao.deve.casar....massamba                                                                                                                                                                                                                                     
2224,Gorongosa,Mozambique,NAO  DEVE CASAR PORQUE OS LARES NAO SAU TODOS FERIZ.DEVE COTINUAR ESTUDAR.INES MAGARA                                                                                                                                                                          
2225,Gorongosa,Mozambique,Nao Deve Casar Pork A Idade E Inferior E O Pretendente Nao Se Escolhe Pod Calhar Com Um Marido K Nao Ajuda  E Melhor Estudar .Prof Nhama Oscar Bangorangoma                                                                                                    
2226,Gorongosa,Mozambique,"WILSON, aluno da 4a . Nao deve casar, deve continuar cm os estudo, porque estudar e futuro melhor.                                                                                                                                                             "
2227,Gorongosa,Mozambique,A MENINA NAÕ PODE-SER CAZADA AINDA TEM MAI AFAZER NO FUTURO. SO EU COREGA DERA JOHANE HENRIQUE S JOAÔ?                                                                                                                                                         
2228,Gorongosa,Mozambique,"Ela não pode casar,porque a escola é unico caminho para acabar com a pobreza.pedro gimo,gravata maríngue.                                                                                                                                                      "
2229,Gorongosa,Mozambique,"Nao deve casar,  porqe casar com menor d idade è crime è com estudo q serà possivel ajudar a familia.ABEL Tomas Binze                                                                                                                                          "
2230,Gorongosa,Mozambique,"N DEV CASAR.VAI AUMENTAR A POBRESA,QUEREMOS FUTUROS  SENTISTAS,AK EM MOZ .DELCIO EM CHITUNGA.                                                                                                                                                                  "
2231,Gorongosa,Mozambique,"NAO CASAMENTO NAO AJUDA QUANDO A ISSO DEVE ESTUDAR AMAE TEM MEDO D MORER SEM COMER MABATIRO MAS ,NAO DEVE. SPEED                                                                                                                                               "
2232,Gorongosa,Mozambique,NAO PODE SER CASAR SO COMUNUAL ESTUDAR                                                                                                                                                                                                                         
2233,Gorongosa,Mozambique,n deve csar pork ela a idad e menr ela dve cntinuar xtudr pork n tudo oq promete homem sempre fará e o arrepndimnto vem dpois pa a mae eu EL da Graça $matucudur$                                                                                              
2234,Gorongosa,Mozambique,"Nao deve casar, porque a mae nao pode obrigar a filha a se casar, ela deveria obrigar a filha a estudar porque estudar é o unico remedio de acabar com a pobreza. Sidônia Caronga-Matucudur.                                                                   "
2235,Gorongosa,Mozambique,Nao deve casar deus abensoe nela.                                                                                                                                                                                                                              
2236,Gorongosa,Mozambique,"A mae deve ser uma empreendedora mandar casar nao é uma solucao, é melhor dexar a menina estudar e procurar homem do seu coracao ,a menina nao é culpada pela desgraca frederico                                                                               "
2237,Gorongosa,Mozambique,N dve csar enquanto houver a vida a xperanca.sergio prof.tsikir.                                                                                                                                                                                               
2238,Gorongosa,Mozambique,Nao deve casar continue com a escola                                                                                                                                                                                                                           
2239,Gorongosa,Mozambique,a soltucao que ginada deve facer  e nao ouvir amae pra que nao si casa agora  so depois d concluiu  a sua formacao tomane antonio funcionario d eduardo mondlane                                                                                               
2240,Gorongosa,Mozambique,nao deve casar ela deve estudar.prof.jk em dassa                                                                                                                                                                                                               
2241,Gorongosa,Mozambique,"nao deve csar agora porque continuando a estudar no futuro tera mais do que a mae precisa agora, abaixa casamento prematuro.Victoria Ticha aluna da E.S.C.REI  10 CLASSE.                                                                                      "
2242,Gorongosa,Mozambique,nao.deue.casar                                                                                                                                                                                                                                                 
2243,Gorongosa,Mozambique,Nao pd casar lhe dexe que prepare a vida dela.ak samuel domingos chota.                                                                                                                                                                                        
2244,Gorongosa,Mozambique,"NAO DEVES CASAR? PORQUE A ESCOLA E MUITO IMPORTANTE ,AMANHA TERA FUTURO MELHOR . CELIO  MARCHEIRA .ZONA  NHAMISONGORA ALDEIA                                                                                                                                   "
2245,Gorongosa,Mozambique,Nao pd casar lhe dexe que prepare a vida dela.ak samuel domingos chota.                                                                                                                                                                                        
2246,Gorongosa,Mozambique,Nao deve casar porque se casa com essa idade amanha ela vai emcontrar um homem da sua vida e tara problema nesse lar. Deve estudar porq é o seu futuro. Jota jota.                                                                                             
2247,Gorongosa,Mozambique,"Mestre jeremias em tsussicana,-Nao deve casar poìs com todo o sacrificio e com a graca de Deus seräo uma familia bem a abensoada e desenvolda e o DeuS ta a olha delas a todo o sacrifìcio pois dia-A- dia.                                                    "
2248,Gorongosa,Mozambique,ok ja pecebe naô a menina deve estuda pork a idade é menor.  baptista tsuassicana                                                                                                                                                                              
2249,Gorongosa,Mozambique,"Teresa, aluna da 9a E. Nao deve casar, deve continuar cm os estudo, a mae deve recorrer a ACCAO SOCIAL                                                                                                                                                         "
2250,Gorongosa,Mozambique,Mateus Victorino nao deve casal cotinua seple estudar pala ver o futuro.                                                                                                                                                                                       
2251,Gorongosa,Mozambique,NAO DEVE CASAR. PORQUE ELA TEM UM FUTURO K PODER AJUDAR A ELA E ASUA FAMILIA.                                                                                                                                                                                  
2252,Gorongosa,Mozambique,BOLINGO D.MBANZE.NAO DEVE CASAR.VAI AUMENTAR A POBRESA .                                                                                                                                                                                                       
2253,Gorongosa,Mozambique,n deve casar porq a escola e a base da sua vida porq correr n e chegar amanha ela a sua vida mudara e a mae ira adorar mais q o passado ela tem q cntinuar xtudar eu EL da Graça matucudur                                                                     
2254,Gorongosa,Mozambique,"ELA DEVE CONTINUAR A ESTUDAR, NAO DEVE E CASA ELA AMANHA PODE AJUDAR A FAMILHA. Eugenia jose                                                                                                                                                                   "
2255,Gorongosa,Mozambique,"NAO DEVE CASAR, PORQUE TEM ESTUDAR PARA O FUTURO,                                                                                                                                                                                                              "
2256,Gorongosa,Mozambique,Nao.porque ela se conseguir terminar xtdr e trabalhar sera melhor futura pra ela juntamente com a mae.boa tard JULIO MUIANGA NA VILA D GORONGOSA.                                                                                                              
2257,Gorongosa,Mozambique,Nao Deve Casa Deve Estudar Mesa Ernesto Bajaj Matucudur.                                                                                                                                                                                                       
2258,Gorongosa,Mozambique,"Nada pod casar,visto que o gero nunca vai sustentar ate a vida da familia,ela dv esudar para preparar o seu futuro melhor fredy                                                                                                                                "
2259,Gorongosa,Mozambique,"Inok-cudzo,nao deve casar pk vai aumentar a sua desgraca,nao é sempre k os casado tem uma vida feliz.                                                                                                                                                          "
2260,Gorongosa,Mozambique,Sou o Director da escola Quembo. A aluna nunca deVe casar. A escola vai ajudar. Contacte nos. Por favor                                                                                                                                                        
2261,Gorongosa,Mozambique,Colega Nao Pode Ser Casado So A Mae Nome Abudala Canda                                                                                                                                                                                                         
2262,Gorongosa,Mozambique,"""Nao deve casar. Uma pequena ajuda,vai fazer com k ela termine a 10 pelo menos e se forme pra  qualquer coisa,dai a mae tera a ajuda eterna,ja k ela tera cada mes um salario.                                                                                 "
2263,Gorongosa,Mozambique,Nao devem casar devem  continuar a estudar DEUS ABENSOA NELA DOMINGOS AUGUSTO FRANCISCO                                                                                                                                                                        
2264,Gorongosa,Mozambique,Nao devem casar devem  continuar a estudar DEUS ABENSOA NELA                                                                                                                                                                                                   
2265,Gorongosa,Mozambique,MERCERINA ZECA TORSIDA NAO DEVE CASAR DEVE ESTDAR PARA UM FUTURO  PARA AMANHA  PORQUE RALE D AGORA NAO TEM GARNTIA                                                                                                                                             
2266,Gorongosa,Mozambique,n pode casar a colega aginada=sou lucas manuel aluno da 1classe EPC NHAMBONDO.                                                                                                                                                                                 
