,RStation,Country,SMS
2267,Gorongosa,Mozambique,"nao da pra aceitar,casamento prematuro fora.bingala preta                                                                                                                                                                                                      "
2268,Gorongosa,Mozambique,Vino cambota mapombue nao deve casar quando casar pode encontrar marido vingador e aumenta soflimento.                                                                                                                                                         
2269,Gorongosa,Mozambique,Ela nao deve casar nao é a solucäo dve estudar aqui helton jogador d mapombue                                                                                                                                                                                  
2270,Gorongosa,Mozambique,Mesa Erensto Matcudur Nao Pode Casar Deve Estudar                                                                                                                                                                                                              
2271,Gorongosa,Mozambique,"A colega nao deve casar ,deve estudar para lutar contra a pobreza. sou Ruminha Manuel Aleixo aluna da escola cristo rei                                                                                                                                        "
2272,Gorongosa,Mozambique,A jinada nao deve casal sedo ela deve continuar na escola pra construir o bem futuro. Sou eu Manthando de muera.                                                                                                                                               
2273,Gorongosa,Mozambique,ELA NAO DEVE CASAR PORQUI A IDADE E MENOR DEVE CONTINUAL COM OS ESTUDOS DEUS AMANHA VAI LHE BENSOAL ESCRITA PELA MONICA JOAO                                                                                                                                   
2274,Gorongosa,Mozambique,eu repodio q ela seja casada agora sem que ela conclua o seu nivel tomane antonio funcionario d eduaro mondlane                                                                                                                                                
2275,Gorongosa,Mozambique,isaquel dias em mapombue nao deve casar com desa seis ano mais sim deve estudar para ter futuro da manha                                                                                                                                                       
2276,Gorongosa,Mozambique,EU RINDA JACINTO NAO DEVE CASAR DEVE ESUDAR PORQUE NAO AJUDA SOU ARUNA EPC D COREJO NAVA JERUZAREM                                                                                                                                                             
2277,Gorongosa,Mozambique,A MENINA NAO PODE CASAR DEVE CONTINUAR COM OS ESTUDOS AJUDARA A FAMILIA NO FUTURO.E.3 de FEVEREIRO.MARIA DO CEU.                                                                                                                                               
2278,Gorongosa,Mozambique,A jinada nao deve casal sedo ela deve continuar na escola pra construir o bem futuro. Sou eu Manthando de muera.                                                                                                                                               
2279,Gorongosa,Mozambique,A ginada deve estudar porq contiando com os estudos qualquer emprego vai ter um bem estar deixando a familia seguro e dai pode casar  velario paulo ando na nona classe e.s.e.m anexa de canda                                                                 
2280,Gorongosa,Mozambique,NAO DEVE CASAR PORQUE NEM TODOS MARIDO AJUDAM A FAMILIA DA MULHER. DE TIAGO JOSÈ F.GRAVATA MANGARA.                                                                                                                                                            
2281,Gorongosa,Mozambique,nao deve casar.gomes em dassa                                                                                                                                                                                                                                  
2282,Gorongosa,Mozambique,Sou Vachamuteco de força especiais  COMANDO.NAO PODE OFICHAL ELA CRIANCA.                                                                                                                                                                                      
2283,Gorongosa,Mozambique,NAO DEVE CASAR E MELHOR ESTUDAR AJUDARA A FAMILIA NO FUTURO AQUI AUGUSTO JULIO FORCAS ESPECIAIS COMANDOS                                                                                                                                                       
2284,Gorongosa,Mozambique,"Não deve casar, continue com o estudos. A mãe deve ir pedir ajuda ao governo. Mwana wa mulungu-MTD                                                                                                                                                             "
2285,Gorongosa,Mozambique,A colega deve estudar .para lutar contra a pobreza.sou aluna da escola cristo rei                                                                                                                                                                              
2286,Gorongosa,Mozambique,Zondane Mapombue nao deve casar sedo porque nao sisabe futuro da flente.                                                                                                                                                                                       
2287,Gorongosa,Mozambique,nao deve casar agora porque ela ainda esta a estudar so dpois d concluir o seu nivel tomane antonio eduardo mndlane                                                                                                                                            
2288,Gorongosa,Mozambique,A AGINADA NAO PODE CASAR COM 16 PODE CONTINUAR COM OS ESTUDOS PARA AJUDAR A FAMILIA NO FUTURO.ALUNA DA E.S.ED.M.INES ZEFERINO.                                                                                                                                 
2289,Gorongosa,Mozambique,EU MARCELINA  ZECA NAO DEVE CASAR PORQUE CASAR SEDO NAO RESORVE NADA DEVE CONTINUAR COM OS ESTUDO                                                                                                                                                              
2290,Gorongosa,Mozambique,"Recebeu uma mensagem do 867896571 nao deve ser casada,mas a mae deve. Obrigado                                                                                                                                                                                 "
2291,Gorongosa,Mozambique,strong nao deve casar favor mae da menina nao pode casar nao si a repende depos porque estes hemem de gora nao estao bem.                                                                                                                                      
2292,Gorongosa,Mozambique,Nao Deve Casar Pork A Idade E Inferior E O Pretendente Nao Se Escolhe Pod Calhar Com Um Marido K Nao Ajuda  E Melhor Estudar                                                                                                                                   
2293,Gorongosa,Mozambique,dve casar s ela gxtou d pretndent e s o pretndent for um funcionario melhor ainda apzar da opcao n se integralment precisa a pbreza faz bm k uma pssoa tnha um dxtino inexperad e s tver um patronato k a pssa ajudar e bm k ela n case.sou eu humberto benjami
2294,Gorongosa,Mozambique,Nao  Deve casar é  so continuar com estudos.tipezene                                                                                                                                                                                                           
2295,Gorongosa,Mozambique,A Ginada nao deve se casar  porq temq estudar para oproximo vera um emprego para q sustentara a familia marcos felix internato da epc 25 d setembro canda                                                                                                      
2296,Gorongosa,Mozambique,Discordo com a opiniao da mae pois ela deve continuar com os estudos                                                                                                                                                                                           
2297,Gorongosa,Mozambique,"""Nao deve cazar. e continura com estudo aq zuma d forca especial d comados.                                                                                                                                                                                    "
2298,Gorongosa,Mozambique,Nao deve casar porque a idade ainda.                                                                                                                                                                                                                           
2299,Gorongosa,Mozambique,"Nào deve casar porque ainda e mais mioda, i chegara a ves de se casar ajudar toda a familha d nome luis.                                                                                                                                                       "
2300,Gorongosa,Mozambique,"viva os estudo,nao nao nao deve casar.prof.joao carlos em dassa                                                                                                                                                                                                "
2301,Gorongosa,Mozambique,AGINADA NAO DEVE CASAR MAS SIM A MAÉ DEVE CASAR PARA SUSTÉNTAR SÉUS FILHOS                                                                                                                                                                                     
2302,Gorongosa,Mozambique,"AMENINA NAO PODE CASAR .PORQUE ELA QUE UAI AJUDAR.A  MAIS NOVA,AMANHA.SALMO ELIASE DE NHAMBONDO?                                                                                                                                                               "
2303,Gorongosa,Mozambique,Nao deve casar.  porqe nem sempre os maridos ajudam a familia da menina mas com estudo terà um futuro melhor.ABEL TOMAS BINZE.                                                                                                                                 
2304,Gorongosa,Mozambique,A MENINA NAO PODE CASAR DEVE CONTINUAR COM OS ESTUDOS PARA AJUDAR A FAMILIA NO FUTURO.MAEZINHA ZEFERINO                                                                                                                                                        
2305,Gorongosa,Mozambique,Nao pode casar aida em criacao deve estudar mais    zacarias                                                                                                                                                                                                   
2306,Gorongosa,Mozambique,A educacao na vida e como raizes duma arvore frondoza k kuand n dsenvolve bem compromete a estrutura d arvore.n dve casar.lucas manuel tenesse_nhambondn                                                                                                       
2307,Gorongosa,Mozambique,A COREGA JINADA NAÕ-SE ACEITA CAZAR ANTE DE CONCRUIRI A ESTUDAR . . SO EU JOHANE HENRIQUE ALUNO.                                                                                                                                                               
2308,Gorongosa,Mozambique,"Sou modina alberto,nao deve casari deve estudari                                                                                                                                                                                                               "
2309,Gorongosa,Mozambique,"Nao deve casar mateus lucas miguel estrongomeni, conhecido por strong                                                                                                                                                                                          "
2310,Gorongosa,Mozambique,"Sou modina alberto,nao deve casari deve estudari                                                                                                                                                                                                               "
2311,Gorongosa,Mozambique,sou Bumark Nao concordo com a mae d Ajinada pork ela deve continuar com os estudos para garantir o seu futuro.                                                                                                                                                 
2312,Gorongosa,Mozambique,a menina deve estudar para ensinar os pais a ler a b c. Bussete                                                                                                                                                                                                
2313,Gorongosa,Mozambique,"Nao deve ser casada, é melhor continuar com  os estudo, porque no futuro ajudaria familia. Nem se ela ser casada  nao vai melhorar vida. Isaque                                                                                                                "
2314,Gorongosa,Mozambique,Nao Deve Casar Continur Aestudar Concord Com Esse Ideia Aument Mais Pobresa Mario Mateus Cherene                                                                                                                                                               
2315,Gorongosa,Mozambique,a menina deve estudar para ensinar os pais a ler a b c                                                                                                                                                                                                         
2316,Gorongosa,Mozambique,Eu jacinto tenho a minha filnha nao deve casar  tem 16 ano sta na nona  crase porque nao deve casar da pra estudar para eu ter um furo  ou um futuro pra era ou para os mas novo deras nest tempo eu j morim e da hi j pod casar                               
2317,Gorongosa,Mozambique,Nao Deve Casar Pode Ir avante con os estudo                                                                                                                                                                                                                    
2318,Gorongosa,Mozambique,"Nao deve ser casada, é melhor continuar com  os estudo, porque no futuro ajudaria familia. Nem se ela ser casada  nao vai melhorar vida. Isaque                                                                                                                "
2319,Gorongosa,Mozambique,nao deva casar porque azinada e uma aluna muito intelezente.porque governo de gorongosa ajuda-la para um bolso de estudo com diz esta musica a traicoa nao depede de rico nem pobre.nos gorongosiano ajudar.mateus conhecido por strong                        
2320,Gorongosa,Mozambique,O AUNA NAÕ-SÉ DEVE CAZAR ....                                                                                                                                                                                                                                  
2321,Gorongosa,Mozambique,"Sou joao karlos, nao deve casar si ela casa os pais devem entrar na cadeia                                                                                                                                                                                     "
2322,Gorongosa,Mozambique,"ela nao deve casar ,porke nao sempre k casar diminui a pobreza podera aumentar o sofrimento. Stela de jesus titos quene quembo.                                                                                                                                "
2323,Gorongosa,Mozambique,Si  casar  asituacão vai ser grave por iso deve estudar.sou eu Dança.                                                                                                                                                                                          
2324,Gorongosa,Mozambique,"Sou modina alberto,nao deve casari                                                                                                                                                                                                                             "
2325,Gorongosa,Mozambique,"A jinada, nao pode casa,porque a escola é a porta da nossa felìcidade                                                                                                                                                                                          "
2326,Gorongosa,Mozambique,Nao Deve Casar Continur Aestudar Concord Aument Mais Pobreza . Sou Isaia                                                                                                                                                                                       
2327,Gorongosa,Mozambique,"BOA TARDE. PRA ME A MENINA DEVE CONTINUAR CM OX EXTUDO, PORQUE AMANHA SERA GENTE.EU GARANTO ISSO PORQUE ONDE A VIDA A EXPERANSA.PAULINA DO INTERNATO.                                                                                                          "
2328,Gorongosa,Mozambique,"Nao deve casar pork nao tem idad,a mae estara a violar os seus direitos,a mae deve encaminha_las as entidads competentes ou entrega_las aos profssors k sinta por elas pra ajuda_las.                                                                          "
2329,Gorongosa,Mozambique,"Lucas_nhambondo(aconselho ki n deve casar porki se n,pode piorar a situacao)n pode casar.e bom continuar a estudar pedindo a deus k vai restaurar a vida deles.                                                                                                "
2330,Gorongosa,Mozambique,"A menina deve continuar a estudar pra ajudar a familia no futuro, porque si ela concordar na ideia da mae simplesmente a familia permanece na mesma ...                                                                                                        "
2331,Gorongosa,Mozambique,NAO DEVE CASAR PORQUE AINDA É MUITO MENOR TEM QUE CONTINUAR COM OS ESTUDOS...CHIRINGA                                                                                                                                                                          
2332,Gorongosa,Mozambique,nao deve casar porque ela deve estudar para no futuro ser alguem e ajudar os irmaos. Jk                                                                                                                                                                        
2333,Gorongosa,Mozambique,Sim nao  devem casar seria continuar a estudar                                                                                                                                                                                                                 
2334,Gorongosa,Mozambique,"A Ginada nao dve csar,dve optar ns estudos alegria vira.sergio prfssor tsikir.                                                                                                                                                                                 "
2335,Gorongosa,Mozambique,"Sou felix lucilo, nao deve cazari deve estudari                                                                                                                                                                                                                "
2336,Gorongosa,Mozambique,NAO DEVE CASAR. PARA PRÉPARAR FUTURÔ DÉLA                                                                                                                                                                                                                      
2337,Gorongosa,Mozambique,"Nao deve casar pork nao tem idad,a mae estara a violar os seus direitos,a mae deve encaminha_las as entidads competentes ou entrega_las aos profssors k sinta por elas pra ajuda_las.                                                                          "
2338,Gorongosa,Mozambique,"Sou felix lucilo, nao deve cazari deve estudari                                                                                                                                                                                                                "
2339,Gorongosa,Mozambique,ELA NAO DEVE CASAR SOU PODE COMTINUA ESTUDAR.                                                                                                                                                                                                                  
2340,Gorongosa,Mozambique,nao deve casar.a filha deve continuar estudar eu nao concordo com amai da azinanda                                                                                                                                                                             
2341,Gorongosa,Mozambique,"Näo, deve casar pois deve ter mais oportunidade de estudar com todo o sacrificio,mas com agraca de deus seräo uma familia bem  densenvolda.                                                                                                                    "
2342,Gorongosa,Mozambique,"nao deve casar porque ainda nao esta promta,anssim sera casamento premeturo                                                                                                                                                                                    "
2343,Gorongosa,Mozambique,Nao deve casar. Porque ela como uma boa estudante e entelegente tem muito a fazer no futuro dela. Ak santos atanásio.                                                                                                                                          
2344,Gorongosa,Mozambique,Nao pode casar. Senhora Aginada è preguicosa.                                                                                                                                                                                                                  
2345,Gorongosa,Mozambique,Sim a ginada deve cotlnuar a estudar na escola porque vai ajudar a familia no futuro.                                                                                                                                                                          
2346,Gorongosa,Mozambique,"Nao devecazari,tequi estudari                                                                                                                                                                                                                                  "
2347,Breeze,Zambia,MARRY  NO  MRS NYOZANI  MFUWE                                                                                                                                                                                                                                  
2348,Breeze,Zambia,"MARRY  NO .SIZIFUNIKA KUKWATITSA ANA ANG,ONO. Mwenda katete. Ndine mwamuna.                                                                                                                                                                                    "
2349,Breeze,Zambia,"MARRY NO! ROYCE BANDA, KATETE IBEX                                                                                                                                                                                                                             "
2350,Breeze,Zambia,Marry no ..man.the govrmet cannot refuse someones life time oppotunity                                                                                                                                                                                         
2351,Breeze,Zambia,"Marry  NO,  BOY  DAVIES NGULUBE NYIMBA.                                                                                                                                                                                                                        "
2352,Breeze,Zambia,Marry  no  female getrude                                                                                                                                                                                                                                      
2353,Breeze,Zambia,MARRY NO NDINE MKAZI                                                                                                                                                                                                                                           
2354,Breeze,Zambia,"Marry (no) mwana wamung'ono 13 yrs afunika ku school.iam victoria banda from katete,chinkhombe basic school.iam female.                                                                                                                                        "
2355,Breeze,Zambia,"Marry  no mwenya Albert Chipata town, man.                                                                                                                                                                                                                     "
2356,Breeze,Zambia,"MARRY NO,becoz early marriage has no merits but alot of demerits.TIMOTHY CHULU                                                                                                                                                                                 "
2357,Breeze,Zambia,MARRY   NO NDINE SITENJA KACHINGA LUNDAZI                                                                                                                                                                                                                      
2358,Breeze,Zambia,MARRY   NO  NDINE MWAMUNA  KUTUMILA KUNO  KU NEW  JIM  KULOWA MBANJA MWAMSANGA SIBWINO KUFUNIKA KUSILIZA SUKULU CHOYAMBA                                                                                                                                       
